permit_id,company,contact,address,town,state,phone,permit_year,waste_types,bear_resistant,service_area
195,T &amp; C Franklin Inc. dba Franklin &amp; Son Rubbish Removal,Cheryl Franklin,368 Franklin Rd,Vernon,VT,8022574915,2025,S,No,&nbsp;
1019,T&amp;T Repeats LLC,Thomas Moore,65 Prospect Street,Montpelier,VT,8022241360,2025,S,Unknown,&nbsp;
928,Tank Out LLC,Tim Mack,256 Jericho Road,Essex Junction,VT,8027357880,2025,SH,No,&nbsp;
2187,"Taplin Septic Pumping and Portable Toilets, LLC (formerly Hans Laggis dba Taplins Septic Service &amp; R",Hans Laggis,PO Box 731,Barton,VT,8026730213,2025,RS,No,&nbsp;
490,"TCI of NY, LLC",Lisa Leone-Beers,PO Box 936,Coeymans,NY,5187569997,2025,HS,No,&nbsp;
2679,"TDI Repair Facility, LLC",Adam Bartemy,50 Babbie Boulevard,Swanton,VT,8028685270,2025,HS,No,&nbsp;
2568,"Thayer Transport, LLC",Stacey,470 Creek Road,Wallingford,VT,8025586146,2025,S,No,&nbsp;
1104,"The Cleaning Crew, Inc.",Robert Montgomery,PO Box 90,Killington,VT,8024222300,2025,S,No,&nbsp;
5,"The Melanson Company, a Tecta America Company, LLC",Kim Ryea,252 Avenue C,Williston,VT,8028626473,2025,S,No,&nbsp;
1063,The University of Vermont,Dorian Evans,667 Spear Street,Burlington,VT,8026560767,2025,HMS,No,&nbsp;
307,Thomas C. LaRose dba LaRose Public Trucking,Thomas LaRose,PO Box 753,St Johnsbury,VT,8027488424,2025,S,No,&nbsp;
1081,Thomas G. Sweet dba Tom&#39;s Rubbish Removal,Thomas G. Sweet,106 Nelson Road,Bennington,VT,8024425536,2025,S,Unknown,&nbsp;
974,Tim Hewitt dba Preferred Restrooms,Tim Hewitt,211 Frank Lord Road,Shrewsbury,VT,8025588955,2025,R,No,&nbsp;
2508,Tiny&#39;s Trash Services and Hauling LLC,Tim Belden,32 W. Corinth Rd,Washington,VT,8025225089,2025,S,No,&nbsp;
1027,Todd Weber dba Weber&#39;s Trash Removal,Kayla Brownell,PO Box 4498,Bennington,VT,5189376823,2025,S,No,&nbsp;
801,"Tom Bodette Landscaping &amp; Excavating Inc., dba Bodette Septic Service",Leslie Bodette,6 LOWER PLAINS RD,MIDDLEBURY,VT,8027709276,2025,R,No,&nbsp;
505,Tourville Trucking LLC,Lee Tourville,PO Box 246,Jericho,VT,8028992009,2025,S,No,&nbsp;
2221,Town of Westmore,Dan Sicard,54 Hinton Hill Road,Orleans,VT,8025253007,2025,S,No,&nbsp;
880,Tracy Hubbard dba Hubbard&#39;s Septic Service &amp; Portable Restrooms,Tracy Hubbard,345 Dailey Place,Rutland,VT,8027732045,2025,R,No,&nbsp;
2217,Tradebe Transportation LLC,"Peter Olsen, Director of Transportation","1433 E 83rd Avenue, Suite 200",Merrillville,IN,2035372503,2025,HS,No,&nbsp;
522,"Tradebe Treatment and Recycling Northeast, LLC","Peter Olsen, Director of Transportation",234 Hobart Street,Meriden,CT,2035372503,2025,HS,No,&nbsp;
2380,Transform Vermont Compost Connection LLC,Shawn Pontbriand,1121 Cox Brook Road,Northfield,VT,8023639789,2025,S,Yes,&nbsp;
2322,Transport Lamarche Inc.,"Eric Lamarche, Vice President",769 Rue Jette,"Acton Vale, Quebec",CN,4502783036,2025,R,No,&nbsp;
2256,Trash Services LLC,Steve and Susan Pratt,PO Box 338,East Barre,VT,8025953445,2025,S,No,&nbsp;
2714,Trash Talkers Waste Management Corporation,Evan Johnson,PO Box 84,Websterville,VT,8028399044,2025,S,No,&nbsp;
2185,Travis Eurbin dba Eurbin Design &amp; Home Improvement,Travis Eurbin,PO Box 504,Barton,VT,802-525-4663,2025,S,No,&nbsp;
2335,Travis Gilman dba Keep It Green Compost,Travis Gilman,376 Delano Road,Irasburg,VT,8026736728,2025,S,No,&nbsp;
2558,Trident Environmental Group LLC,Lisa Raye,15 SHIRE DR,Norfolk,MA,5082293545,2025,HS,No,&nbsp;
944,"Triple L Lumber Co., Inc.",Leon O. Wilson,64 Foster Hill Road,Henniker,NH,603-428-3500,2025,S,No,&nbsp;
511,"Tri-S Environmental Services, Inc.",Mike Kopeski,25 Pinney Street,Ellington,CT,8608752110,2025,H,No,&nbsp;
514,Triumvirate Environmental LLC,Donna McLean,200 Innerbelt Road,Somerville,MA,6176288098,2025,HSM,No,&nbsp;
602,Twin State Management LLC dba Ruggiero Trash Removal,John Williams,PO Box 434,Saxtons River,VT,8028692235,2025,S,No,&nbsp;
723,"U.S. Bulk Transport, Inc.",Kimberly Bayhurst,205 Pennbriar Drive,Erie,PA,8148249949,2025,HRS,No,&nbsp;
879,Univar Solutions USA LLC dba Univar Solutions USA,Tamisha Howard,"3075 Highland Parkway, #200",Downers Grove,IL,7086167035,2025,HS,No,&nbsp;
2350,Upper Valley Compost LLC,Roger Myott,171 jeff heights circle,Jeffersonville,VT,8022381703,2025,S,No,&nbsp;
2786,Upper Valley Septic Professionals LLC,Jason Quenneville,107 BLUEBERRY HILL DR,Hanover,NH,6034485000,2025,R,No,&nbsp;
1103,"US Environmental, Inc",Edward W Wisneski,409 Boot Rd,Downingtown,PA,6109569074,2025,HSR,No,&nbsp;
2650,"Vac Truck Services of New England, LLC",Denise LaPierre,6 Point Breeze Rd,Uncasville,CT,8602661816,2025,HS,No,&nbsp;
2119,Van Denton dba Denton &amp; Son,Van Denton,64 Paintworks Road,Brandon,VT,8022478340,2025,S,No,&nbsp;
246,Vaughn Hodgdon dba Vaughn Hodgdon Trucking,Nicole Hodgdon,1025 US Route 2,Guildhall,VT,8025356261,2025,S,No,&nbsp;
17,"Veolia ES Technical Solutions, LLC",Denise Krous,1 Eden Lane,Flanders,NJ,9736917321,2025,HMS,No,&nbsp;
2289,"Vermont Compost Company, Inc.","Sid Hammer, Director of Operations",1996 Main Street,Montpelier,VT,802-371-9549,2025,S,No,&nbsp;
996,Vermont Shred LLC,Jon LaShure,49 Torrie Dr,Swanton,VT,8023093591,2025,SM,No,&nbsp;
527,"Vermont Transco LLC (Vermont Electric Power Company, Inc.)",Thomas Veysey,366 Pinnacle Ridge Road,Rutland,VT,8027726218,2025,HS,No,&nbsp;
2498,Vermont Trash Removal LLC,Tilar Amidon,PO Box 125,North Springfield,VT,8025910095,2025,S,Yes,&nbsp;
531,"Vershire, Town of","Town Clerk, Gene Craft",6894 VT Route 113,Vershire,VT,8026852227,2025,S,No,&nbsp;
976,Vertecero LLC dba Ace Trash,Jonathan Skates,PO Box 161,Stowe,VT,8022539222,2025,S,Yes,&nbsp;
2546,"VLS Lancaster, LLC.",Krista Hemming,1076 Manheim Pike,Lancaster,PA,7173932627,2025,HSR,No,&nbsp;
2640,"VR Logistics Services, LLC",Joshua Capraro,133 Boston Post Road,Weston,MA,9784377509,2025,S,No,&nbsp;
2316,"VTUMS Vermont Utility Management Services, LLC",Jill Marsano,P.O. Box 152,Hinesburg,VT,8023772316,2025,SR,No,&nbsp;
2641,W. Carrera Soil Management Corp,Bruna Martins,132 Whittemore Street,Tewksbury,MA,9786087899,2025,S,No,&nbsp;
2264,"W. Hook Septic, LLC dba Silloway Septic Service",Emmy Jarvis,82 East Randolph Rd,Chelsea,VT,802-728-5308,2025,R,No,&nbsp;
859,"W.C. Gurrisi &amp; Sons, Inc.",Linda Vining,0 Corwin Street,Peabody,MA,9788186248,2025,S,No,&nbsp;
844,W.L. French Excavating Corporation,Mark Sargent or Diarmuid Gallagher,14 Sterling Road,Billerica,MA,9786632623,2025,SR,No,&nbsp;
766,"Wagner&#39;s Sales &amp; Service, Inc., dba Wagner&#39;s Construction",GEORGE R. JR &amp; TAMMY WAGNER,62 Burke Hill Road,West Burke,VT,8024673372,2025,S,No,&nbsp;
2768,"Walker Construction, Inc.",Katherine Walker,5950 Waterbury-Stowe Road,Waterbury Center,VT,8022447400,2025,S,No,&nbsp;
908,Walter LaRochelle dba Gator Trucking,Walter LaRochelle,151 Kelly Road,Dayville,CT,8602081846,2025,S,No,&nbsp;
770,"Washington Electric Cooperative, Inc.",Louis Porter,PO Box 8,East Montpelier,VT,8022235245,2025,H,No,&nbsp;
535,"Waste Management of NH, Inc. (dba Cheshire Sanitation)",Shawn Hood,25 Monadnock Highway,Swanzey,NH,6033521035,2025,SR,Yes,&nbsp;
2500,Wasted* Public Benefit Corporation,Thor Retzlaff,491 Industrial Ave,Williston,VT,8023433724,2025,R,No,&nbsp;
2598,Waterbury Fix it LLC dba Waterbury Carpenter,Damian Roman,161 South Main Street,Waterbury,VT,8027354444,2025,S,Yes,&nbsp;
985,Wayne Frenette dba Wayn-o&#39;s Disposal Service,Wayne/Tricia Frenette,PO Box 555,Lancaster,NH,6037882342,2025,S,Yes,&nbsp;
2461,Weed Precast LLC DBA PumpTech,Linda Dimmick,187 South Main street,Newport,NH,8027289170,2025,RS,No,&nbsp;
540,West Central Environmental Corp,Joseph D. Murphy,P.O. Box 83,Rensselaer,NY,5182726891,2025,HS,No,&nbsp;
542,Western Oil Inc.,Jared Raftery,PO Box 518,Lincoln,RI,4017278600,2025,HS,Yes,&nbsp;
2247,Wetherby&#39;s Trash Removal LLC,John Wetherby,16 Gulf Road,Richford,VT,8028483550,2025,S,No,&nbsp;
2746,"White Falcon Solutions, LLC",Lathrop Brownell,70 S Water Street,Vergennes,VT,8023160529,2025,S,No,&nbsp;
691,"White Mountain Resource Management, Inc., dba Resource Management, Inc.",Maria Feraco,1171 NH Rte 175,Holderness,NH,6035368900,2025,RS,No,&nbsp;
2189,White&#39;s Septic Service VT LLC,Adrian Dutkewych,259 Old Cherry Mountain Road,Jefferson,NH,6036310660,2025,R,No,&nbsp;
548,"Whitney Trucking, Inc.",Dan Whitney/Michele,576 Pine Meadow Road,Northfield,MA,4134985591,2025,RS,No,&nbsp;
1083,Wind River Environmental LLC,Steve LaPorte,"46 Lizotte Drive, Suite 1000",Marlborough,MA,6177749098,2025,RS,No,&nbsp;
704,Windham Solid Waste Management District,"Vicki Hayes, Anita Grant",327 Old Ferry Road,Brattleboro,VT,802-257-0272,2025,S,No,&nbsp;
752,Winterbottom Trucking LLC,Darlene Harvey,PO Box 62,West Chazy,NY,5185692974,2025,S,No,&nbsp;
661,Working Dog Septic Service Inc.,Lawrence Young Jr.,504 Fletcher Road,Cambridge,VT,802-343-1657,2025,R,No,&nbsp;
2234,World Resources Company,"Dale Schneck, Vice President",170 Walnut Lane,Pottsville,PA,5706224747,2025,HRS,No,&nbsp;
2695,Wright&#39;s Roll-Off LLC,Wade Wright Jr.,221 Cross Road,Barton,VT,802-673-7342,2025,S,No,&nbsp;
769,"WRS Environmental Services, Inc. dba Champion Environmental Services",Courtney Lampasona,65 Corporate Drive,Holtsville,NY,631-924-8111,2025,HRS,No,&nbsp;
2151,Wyman-Frasier Lumber Mill Inc.,Jon Wyman,158 Wyman Road,Brandon,VT,802-770-9113,2025,S,No,&nbsp;
1065,Zampini Associates LLC,Donna Cauti or Dino Zampini,PO Box 39,Reading,VT,8024849312,2025,S,No,&nbsp;
