permit_id,company,contact,address,town,state,phone,permit_year,waste_types,bear_resistant,service_area
247,"Horwith Trucks, Inc.",REGINA GRIM,PO BOX 7,Northampton,PA,6102612220,2025,S,Yes,&nbsp;
248,"Houghton Sanitary Service, Inc.",Jeff Houghton,416 Guilford Center Road,Guilford,VT,8022549221,2025,R,No,&nbsp;
2574,Howe Enterprises Inc.,Nicholas Howe,33 Russell Road,Tunbridge,VT,8025050106,2025,R,No,&nbsp;
250,"Hubbard Brothers, Inc.",Tim Hubbard/Sue Perry,PO Box 315,Rutland,VT,8027732259,2025,HSR,No,&nbsp;
2624,Huff and Puff Demolition and Junk Removal LLC,Josh Murray,PO BOX 274,Richmond,VT,802-343-5356,2025,S,No,&nbsp;
2665,"Hunter Excavating, Inc.",Patti Johnson,2218 VT ROUTE 100,S. Londonderry,VT,8028567165,2025,S,No,&nbsp;
2238,"Interstate Ventures, Inc.",Paula McDonald,1261 E. Tri County Blvd,Oliver Springs,TN,8654828670,2025,HS,No,&nbsp;
2273,Iron Mountain Incorporated,Bill Blauvelt,11 Morse Drive,"Essex Jct.,",VT,8023096038,2025,S,No,&nbsp;
2662,"Ironclad Environmental Solutions, Inc.",Callan Jacobs,550 W 36th Street,Jasper,IN,9208502483,2025,S,No,&nbsp;
2312,Island Excavating Corp.,Majken Tranby,4 Island Circle,Grand Isle,VT,8023724473,2025,S,Unknown,&nbsp;
2203,Island Pump and Tank LLC,"Matthew Schieferstein, CHMM",40 Doyle Court,East Northport,NY,6314622226,2025,H,No,&nbsp;
2259,"It&#39;s About Time Logistics, LLC",Louise Cadavid,174 South Road - Suite 111,Enfield,CT,7815718056,2025,S,No,&nbsp;
926,"IWT Transport, Inc.",David OBrien,5 FIR COURT,Oakland,NJ,9737685107,2025,HS,No,&nbsp;
924,J A LaRochelle Trucking LLC,John A LaRochelle,362 Pompeo Rd,N Grosvenordale,CT,5083266737,2025,RS,No,&nbsp;
2565,"J R AND SONS CONSTRUCTION, INC.",Lauren Russo,4 Hallberg Park,North Reading,MA,7812584455,2025,S,No,&nbsp;
2622,J&amp;J Odd Job Services LLC,Jake Ring,655 Church Road,Colchester,VT,8023916218,2025,S,No,&nbsp;
988,"J. P. Sicard, Inc.",Jason Sicard,PO Box 508,Barton,VT,8025259506,2025,S,No,&nbsp;
2352,"J.C. RENDERING, INC.",Jason Caruso,201 Jackson Rd,Frankfort,NY,3157325759,2025,S,No,&nbsp;
262,"J.K. Lynch Disposal, Inc.",Cheryl Dube,49 South Hill Road,Colebrook,NH,6032374446,2025,S,Yes,&nbsp;
2737,J.Labrecque LLC,Erin Bovat,294 Westford Milton Road,Westford,VT,8023933303,2025,S,No,&nbsp;
2782,Jake&#39;s Septic Service LLC,Jake Ovitt,1199 Calhoun Road,Island Pond,VT,8026733462,2025,R,&nbsp;,&nbsp;
763,James Davis dba Aaron Septic &amp; Drain,James T. Davis,241 Raven Rock Road,Arlington,VT,802-430-9555,2025,R,No,&nbsp;
2607,James Mayer DBA Mr. Handy,James Mayer,563 South Wheelock,Lyndonville,VT,8022823503,2025,S,No,&nbsp;
2196,Jamie Strotmeyer dba Me and My Truck,Jamie Strotmeyer,81 Henry Street,Burlington,VT,8023380480,2025,S,No,&nbsp;
2224,Jared Rouleau dba A&amp;J Recycling,Amantha Rouleau,1931 North Hollow Rd,Granville,VT,802-505-0630,2025,S,No,&nbsp;
2600,Jarrett Drown d/b/a Drown Trucking,Jarrett Drown,857 Center Rd,Hardwick,VT,8022794097,2025,S,No,&nbsp;
2456,JASON CARTWRIGHT TRUCKING LLC,JASON CARTWRIGHT,1625 SCOTT HILL RD,Berlin,VT,8022617535,2025,SR,No,&nbsp;
2673,Jason Hooks DBA Small Town Trash Removal,Jason Hooks,10 Briggs Street,North Adams,MA,4136639302,2025,S,Yes,&nbsp;
268,Jay&#39;s Septic Tank Cleaning LLC,Brenton K. Southworth,4551 Route 5,Thetford Center,VT,8023339485,2025,R,No,&nbsp;
2493,JBGB Transport LLC,Justin Bona,630 York St,Lyndonville,VT,8022743697,2025,S,No,&nbsp;
936,Jeffrey Bronson dba Bronson Transport,Jeff Bronson,292 Quiet Valley Road,Shoreham,VT,8029894195,2025,S,No,&nbsp;
982,Jeffrey Lloyd dba Rutland Rubbish,Jeffrey Lloyd,25 Meadow Street,Rutland,VT,8027751527,2025,S,No,&nbsp;
2542,Jeff&#39;s Rubbish Removal LLC,Jennifer Wright,PO Box 204,Windsor,VT,8022639691,2025,&nbsp;,No,&nbsp;
658,Jeff&#39;s Trucking LLC,Jeffrey Scott Hook,786 US Route 5 #6,Windsor,VT,8023563430,2025,S,No,&nbsp;
1109,Jewell Specialized Inc.,"Chris Jewell, President",PO Box 295,Plainfield,NH,6033819897,2025,S,No,&nbsp;
2555,Jim Holton DBA Junk All Gone,Jim Holton,307 Flat Iron Road,Wolcott,VT,8027300303,2025,S,No,&nbsp;
2676,JNVSeptic LLC,Chris Johnson,64 veterans park rd,Claremont,NH,6035815586,2025,R,No,&nbsp;
2648,JOE AND JEN LLC DBA Calkins Portable Toilets,Lisa Calkins,PO Box 21,Danville,VT,8026842255,2025,R,No,&nbsp;
962,John Couture dba J.C. Trucking,John Couture / Shannon Couture,2551 Coventry Station Road,Newport,VT,8022745320,2025,RS,No,&nbsp;
116,John L. Cookson dba Cookson&#39;s Trucking,John L. Cookson,1048 Lovely Road,Marshfield,VT,8022792466,2025,S,No,&nbsp;
279,John Trombley dba John Trombley Construction &amp; Septage,John Trombley,1549 Pencil Mill Road,Castleton,VT,8022732527,2025,R,No,&nbsp;
2204,"Josh Fenoff Siteworks, LLC",Josh Fenoff,367 Fenoff Heights Lane,Waterford,VT,8025357941,2025,HS,No,&nbsp;
2319,Josiah Nolt dba Countryside Septic,Josiah Nolt,192 Hilltop Drive,Johnson,VT,18025856470,2025,R,No,&nbsp;
2547,JR &amp; Sons Junk Removal INC.,Kristen Jewell,PO BOX 168,Vergennes,VT,8027359760,2025,S,No,&nbsp;
2511,"JRP Waste Oil Service, Inc",Gregg Baitinger,PO Box 570,Oxford,PA,8563087336,2025,HSR,No,&nbsp;
2205,JSP Job Site Pumping LLC,Jeffrey Townsend,4888 Pleasant Street,Randolph,VT,8027284137,2025,R,No,&nbsp;
2771,Juan C Rodriguez DBA ROS Transportation,Corina Lima,"500 South Main Street, Apt #2",Manchester,NH,7812674631,2025,R,No,&nbsp;
656,Juddy&#39;s Septic Service Inc.,Brian Judd,PO Box 226,Morgan,VT,8028954196,2025,R,No,&nbsp;
2713,JunkitVT LLC,Miles Jordan,24 Mt Philo Rd,Charlotte,VT,8023639119,2025,S,No,&nbsp;
734,Justin Adams dba Quinttown Container Service,Justin Adams,PO Box 13,Orford,NH,6033534240,2025,S,No,&nbsp;
2736,Justin Morgan Construction LLC,Justin Roy Morgan,2147 Cormier Rd,Danville,VT,8022748984,2025,SR,No,&nbsp;
289,"K&amp;R Portable Restroom Services, LLC",ZACHARIAH CONLEY,PO BOX 121,ORFORD,NH,6033534106,2025,R,No,&nbsp;
2512,K. Bellavance Land Works &amp; Hauling LLC,Ashley N Collins,69 PITMAN RD,Barre,VT,8022798488,2025,S,No,&nbsp;
2651,"KAG Specialty Products Group, LLC",Mary Schnick,5301 Buttonwood Dr,Madison,WI,6082308217,2025,HS,No,&nbsp;
2780,"KASCON, LLC",Dennis Keith,650 Main St,Bennington,VT,3158612211,2025,HS,&nbsp;,&nbsp;
2765,Katzenbach Sand &amp; Gravel LLC,Clark Katzenbach,75 East Griggs Road,Irasburg,VT,8024875150,2025,S,No,&nbsp;
2581,Keane Trucking LLC,Christopher Keane,169 Keane Mountain Way,Orange,VT,8024765617,2025,S,Yes,&nbsp;
2478,Keep It Simple LLC DBA KIS Clean Outs,Margaret Pridgen,PO Box 111,Wilder,VT,802-280-5408,2025,S,No,&nbsp;
687,Kenneth A. Ross dba K-N-S Tire Recycling,Kenneth Ross,PO Box 503,Albany,VT,802-755-9278,2025,S,No,&nbsp;
2226,Kevin Palazzo dba Up With The Sun Trucking,"Kevin Palazzo, Owner",4 Welch Lane,Raymond,NH,9784231584,2025,RS,No,&nbsp;
2444,Kevin Pothier d/b/a KMC Excavating,Kevin Pothier,807 Bushey Hill Rd.,Newport,VT,8025228452,2025,S,No,&nbsp;
2661,Kim Jones DBA Jones Rubbish Removal,Robert &amp; Kim Jones,1538 Route 30 North,Bomoseen,VT,802-273-3795,2025,S,No,&nbsp;
2705,Kings L.L.C.,Ricky King Jr.,471 Vermont Route 7A,Shaftsbury,VT,8027332558,2025,S,No,&nbsp;
2246,Kingsbury Companies LLC,Travis Kingsbury,58 Center Road,Middlesex,VT,8882087219,2025,RS,No,&nbsp;
2631,Kirby Mountain Lawns + Landscaping LLC,Caleb Temple,1693 Ridge Road,East Burke,VT,802-535-5321,2025,S,No,&nbsp;
295,"Kirk Fenoff &amp; Son Excavating, LLC",Kirk Fenoff,24 Old Stagecoach Road,Danville,VT,8026843353,2025,S,No,&nbsp;
2545,"L &amp; W Williams Construction, Inc. dba &quot;The Can Man&quot;",Rebecca Williams,736 South Road,Peru,VT,8029996737,2025,S,No,&nbsp;
2634,"L&amp;M Service Contractors, LLc",Sue E Esty,287 River Rd,Norwich,VT,6033591656,2025,S,No,&nbsp;
2642,"Laidlaw Carriers Bulk GP, Inc.",Tyler Tilker,646 Athlone Ave.,Woodstock,ON,9057191629,2025,H,No,&nbsp;
2723,Lamoille Regional Solid Waste Management District,Joyce Majors,29 Sunset Drive,Morrisville,VT,8028887317,2025,S,No,&nbsp;
2606,"LaPete Construction &amp; Trucking, LLC",Chris LaPete,P.O. Box 50,New Haven,VT,8023432758,2025,S,No,&nbsp;
901,Lavallee Trucking &amp; Excavating LLC,James Lavallee / Kristi Szawlowski (Secretary),PO Box 383,Hatfield,MA,4139234555,2025,S,No,&nbsp;
2556,Leonard Keys DBA Keys Dumpsters,Lenny (Leonard) Keys,5158 State Route 22,Salem,NY,5189377097,2025,S,No,&nbsp;
2250,Leslie Daniels dba Les Daniels Services,Leslie Daniels,975 Steele Hill RD,Randolph,VT,8022799690,2025,S,No,&nbsp;
882,Lev V. Kalinin,Lev V. Kalinin,115 Prospect Street Ext.,Lebanon,NH,8025783676,2025,S,No,&nbsp;
2702,Lewco LLC,MATTHEW T LEWIS,747 Randall Hill Rd,Springfield,VT,8023766463,2025,S,No,&nbsp;
2455,LIQUORE SAND AND GRAVEL LLC,Jane Zebrowski and/or Nino Valentino,117 North Street,Enfield,CT,8607630378,2025,S,No,&nbsp;
2707,Locol Waste LLC,Adam Pasquale,1058 Jassamine Way,Fort Lee,NJ,2014246770,2025,S,No,&nbsp;
785,Lois Jerome dba Jerome Trucking,Lois Jerome,87 Shaw Road,Cambridge,VT,8028496933,2025,S,No,&nbsp;
2161,Longe Trucking LLC,Timothy Longe jr,"1849 Davis Rd Enosburg, VT",Enosburg Falls,VT,8027829916,2025,S,No,&nbsp;
2759,"Longhorn Trucking Co., Inc.",Vince Logan,6605 State Hwy 5,Fort Plain,NY,5188571134,2025,S,No,&nbsp;
2793,Louis Bates DBA Bate&#39;s Property Maintenance,Karen Delorme,1139 Lower Newton Road,St. Albans,VT,8027525380,2025,S,&nbsp;,&nbsp;
1106,"Luxury Event Restrooms, Inc.",Mike Solomon,5654 Ethan Allen Hwy,Charlotte,VT,8027440066,2025,R,No,&nbsp;
1012,"Lyle Webb Jr., dba Webb &amp; Sons Landscaping",Lyle Webb,P O Box 956,Middlebury,VT,8023244237,2025,S,No,&nbsp;
2744,Mack Farnsworth DBA Farnsworth Trucking and Excavating,Mack Farnsworth,126 Upper Walpole Rd,Walpole,NH,8022891161,2025,S,No,&nbsp;
995,"Maine Labpack, Inc.",Mitchell Daigle,163 Thadeus Street,South Portland,ME,2077671933,2025,HSM,No,&nbsp;
2554,"Major L. Rodd, The Roofer, Inc. DBA Rodd Roofing",Silas Ratico,49 Perkins Street,Saint Johnsbury,VT,8027484555,2025,S,No,&nbsp;
2709,Mangan Excavation LLC,Gideon Mangan,116 McCrillis Road,Marshfield,VT,8022496938,2025,S,No,&nbsp;
609,"Mansfield Environmental Abatement Group, Inc.",Dan King,PO Box 8535,Essex,VT,8028789975,2025,HS,No,&nbsp;
2604,Marden Environmental Transport LLC,Nancy Marden,87 Laurel Hill Rd,Brookfield,CT,8608980242,2025,HS,No,&nbsp;
1009,Maria Glabach dba Glabach Farm Contractors,Maria Glabach,32 Nourse Hollow Road,Dummerston,VT,8022570939,2025,S,No,&nbsp;
2402,Mark Lawson dba Mar-Jo Acres,Mark Lawson,741 Campbell Road,Irasburg,VT,8027542803,2025,S,No,&nbsp;
768,"Markowski Excavating, Inc.",Gregory Markowski,PO Box 69,Florence,VT,8024836469,2025,S,No,&nbsp;
2523,Mascoma Waste Management LLC,"John Pellerin, Owner",PO Box 427,Enfield,NH,6033042155,2025,S,Yes,&nbsp;
2730,Matten Excavation LLC,Andy Matten,2703 VT-100,Newport Center,VT,8026738790,2025,S,No,&nbsp;
518,Matthew O Swann Enterprises LLC DBA Tuttle’s Trucking,Trista Shappy,PO Box 1,Swanton,VT,8028687838,2025,S,Yes,&nbsp;
342,Maumee Express Inc,John Brothers,PO Box 278,Somerville,NJ,800-742-5542,2025,HS,No,&nbsp;
937,McKirryher Waste Services Inc.,Rick or Kim McKirryher,224 Floating Acres Place,Rutland,VT,8027752749,2025,S,Yes,&nbsp;
719,"McVac Environmental Services, Inc.",Charles Demers,481 Grand Avenue,New Haven,CT,203-498-1427,2025,HRS,No,&nbsp;
2656,MEC JUNK REMOVAL &amp; HAULING SERVICES LLC,Mark E Currier,PO Box 19,Island Pond,VT,8026240429,2025,S,No,&nbsp;
2336,Megan Kolbay dba Earthgirl Composting,Megan Kolbay,Po Box 594,Barre,VT,8028395017,2025,S,No,&nbsp;
2635,Melnik Farms LLC,Paul Kokoski,188 Mill Village Rd,Deerfield,MA,4135310633,2025,S,No,&nbsp;
1004,Memphremagog Rentals LLC,Douglas Spates / Andrew Carbine,89 Third Street,Newport,VT,8023342262,2025,S,No,&nbsp;
2492,Michael Pelton dba Stoney Mountain Farm,Michael Pelton,1001 West Windham Rd,Windham,VT,8023802253,2025,S,No,&nbsp;
441,Michael Szymanski dba MS Septic Service,Mike Szymanski,PO Box 656,Montpelier,VT,802-249-0147,2025,R,No,&nbsp;
355,Michaud Septic Service LLC,Crystal Michaud,207 Belfry Rd,East Hardwick,VT,8024726682,2025,R,No,&nbsp;
356,Miller Environmental Group Inc,DON CURRAN,538 Edwards Avenue,Calverton,NY,845-905-9670,2025,HS,No,&nbsp;
2230,MK Trucking LLC,"Michael Sevigny, Owner",1186 Hebert Road,Williamstown,VT,8029174653,2025,S,No,&nbsp;
462,Moran Environmental Recovery LLC,Jeff Magyar,75 D York Avenue,Randolph,MA,7818151100,2025,HSM,No,&nbsp;
987,More Waste Solutions LLC,Beth-Anne Searles,1138 Old Quechee Road,White River Jct,VT,8022953368,2025,S,Yes,&nbsp;
2667,Mow N Maintain Property Maintenance LLC,Nicholas George,5052 Route 116,Shelburne,VT,802-391-7773,2025,S,No,&nbsp;
822,"Mr. Bult&#39;s, Inc. (dba MBI)","Steve Dalpe, Terminal Manager",PO Box 846,Newport,VT,8023341784,2025,RSM,No,&nbsp;
2472,"MT3 Unlimited, LLC",Mike Tkaczyk III,3856 Guilford Center Road,Guilford,VT,8022541688,2025,S,No,&nbsp;
2506,Munoz Trucking LLC,Guillermo Munoz,"1 Dix st,apt 1,Revere MA 02151",Revere,MA,6179593529,2025,SR,No,&nbsp;
2325,Music Mountain Compost LLC,Zach Cavacas,2195 Music Mountain Road,Stockbridge,VT,8023423834,2025,S,Yes,&nbsp;
364,Myers Container Service Corp.,Lynn Bergeron,PO Box 38,Winooski,VT,8026554312,2025,SR,No,&nbsp;
856,"Mystic Motor Transportation Co., Inc.",Charles Daly,PO Box 1082,Billerica,MA,9786675656,2025,S,No,&nbsp;
2233,"N. A. Manosh, Inc.","Nick Manosh, President",120 Northgate Plaza,Morrisville,VT,8028885722,2025,SR,No,&nbsp;
934,Nathan Guay dba At Your Disposal Trucking,Nathan Guay,58 River Road,Underhill,VT,802-279-1367,2025,S,No,&nbsp;
630,"Naughton &amp; Son Recycling, LLC",Jody Whelton,PO Box 464,Bradford,NH,6039382282,2025,S,No,&nbsp;
2207,"NEIE Medical Waste Services, LLC",Patricia Sumner,3100 New Kent Highway,Quinton,VA,8049328412,2025,MS,No,&nbsp;
2454,NEK Rubbish LLC,Thomas Sline,P.O. Box 712,Lyndonville,VT,8025351430,2025,S,Yes,&nbsp;
153,"New England Quality Service Inc., dba Earth Waste &amp; Metal",Amanda Nadeau,PO Box 68,Rutland,VT,8027757722,2025,S,No,&nbsp;
2623,New England Water Systems Inc.,Magen Ostiguy,168 Ostiguy Drive,Lowell,VT,8027442666,2025,R,No,&nbsp;
2590,Nick&#39;s Landscaping &amp; Firewood LLC,Nick Durocher,842 Morey Rd.,Sutton,VT,802-535-8485,2025,S,No,&nbsp;
2138,No Waste Compost L3C,"Cameron B. Scott, Co-Owner",20 Susie Wilson Road Unit D,Essex Junction,VT,8023731707,2025,S,No,&nbsp;
373,"Normandeau Trucking, Inc.",Dennis Normandeau,PO Box 243,Groveton,NH,603-636-1671,2025,S,No,&nbsp;
927,"North Coast Services, LLC",Thomas Fatcheric,44 Locke Road,Concord,NH,603-610-7901,2025,S,No,&nbsp;
2431,North Road Excavation LLC,Dylan McCullough,4866 North Rd,Bethel,VT,8023699989,2025,S,Yes,&nbsp;
2473,"North Star Rubbish Removal, LLC",Bonnie Garrett,PO Box 224,Bridgewater Corners,VT,8029529524,2025,S,No,&nbsp;
377,Northeast Kingdom Waste Mgmt District,Corey Raymond,PO Box 1075,Lyndonville,VT,8026263532,2025,S,No,&nbsp;
636,"Northeast Lamp Recycling, Inc.",Raymond Walter Graczyk,256 Main Street P.O. Box 680,East Windsor,CT,8602094601,2025,HS,No,&nbsp;
2653,"Northern Hill Trucking, LLC",Nicholas Pion,2024 Randolph Road,Morrisville,VT,8023937829,2025,S,No,&nbsp;
738,Northwest VT Solid Waste District,Pam Bolster,158 Morse Drive,Fairfax,VT,8025245986,2025,SH,No,&nbsp;
724,"Northwoods Excavating, Inc.",Michelle Batchelder,289 Ulman Road,Thetford Center,VT,8027853162,2025,S,No,&nbsp;
1101,"Nott&#39;s Excavating, Inc.",Raymond S. Nott II,185 Equestrian Way,"White River Jct.,",VT,8022952734,2025,S,No,&nbsp;
384,Oil Recovery Corporation,Luke Gagnon,138 Palmer Ave,West Springfield,MA,413-737-2949,2025,HSM,No,&nbsp;
973,One World Environmental LLC dba Uncle Bob&#39;s Septic Service and dba 802 Restrooms,Julie Wright,63 Shields Dr,Bennington,VT,8022322222,2025,R,No,&nbsp;
2258,Organix Recycling LLC,James Crownover,220 S Commerce St,Russellville,AR,4699191858,2025,S,Unknown,&nbsp;
2726,"P &amp; L Trucking, Inc.",LAURIE GOODRICH,PO Box 993,Chester,VT,8022913955,2025,S,No,&nbsp;
391,P&amp;P Septic Service Inc.,"Jarod Pratt, Vice Pres.",PO Box 639,Williston,VT,8026586243,2025,RS,No,&nbsp;
392,"Page E.T.C., INC",Kelley Clark,2758 TROMBLEY RD,Weedsport,NY,315-834-6681,2025,HS,No,&nbsp;
2778,"Page G.T.C., Inc.",Kelley Clark,2758 TROMBLEY RD,Weedsport,NY,3156044001,2025,HSR,No,&nbsp;
2750,"Palmer Waste, LLC",Eric Palmer,294 Magee Hill Rd,Hinesburg,VT,8029220222,2025,S,No,&nbsp;
2315,Paul Morse DBA Morse Transport,Paul Morse,553 Vt Rte. 100,Newport Center,VT,8022492923,2025,SR,No,&nbsp;
593,Perras Brothers LLC,Heath Perras,691 Earl Gray Road,Morrisville,VT,8028884353,2025,SR,No,&nbsp;
2503,"Peters General Contracting, Inc.",Gerard Peters,POBox 212,Albany,VT,8027556743,2025,S,No,&nbsp;
396,Pete&#39;s Rubbish Removal Inc.,Neil Robie,1130 Mt. Moosilauke Highway,Pike,NH,603-989-5300,2025,S,Yes,&nbsp;
972,"Pioneer Tank Lines, Inc.","Jessica Sandstrom, Safety &amp; Compliance Manager",12501 Hudson Road South,Afton,MN,6514368296,2025,H,No,&nbsp;
2608,"PJD Septic Services, LLC",Paul J Dionne,PO BOX 297,Stoddard,NH,6034467106,2025,R,No,&nbsp;
402,Precision Industrial Maintenance LLC,Alex Hildebrand,1710 Erie Blvd,Schenectady,NY,5183465800,2025,HSR,No,&nbsp;
2781,Precision Property Maintenance LLC,Adam Trudo,65 Lindale Drive,Colchester,VT,8023557696,2025,S,No,&nbsp;
2579,Pretty Potty Vermont LLC,Cory Irish,853 Route 7 South,Milton,VT,8029220816,2025,&nbsp;,No,&nbsp;
711,Prolerized New England Company LLC,Donna Maroney,14 Field Court,North Kingstown,RI,4012654573,2025,S,No,&nbsp;
2563,Quality Environmental Service LLC,Jamie Crowley,112 Whipple Dr,Guilford,VT,8022541155,2025,S,No,&nbsp;
2610,R B Greene Trucking LLC,Randy Greene,41 UNION POINT RD,Webster,MA,8603823272,2025,&nbsp;,No,&nbsp;
2137,R&amp;J Trucking LLC,Arlene Fisher,PO Box 311,Shelburne,VT,8029853296,2025,S,Unknown,&nbsp;
2789,R&amp;S Tree &amp; Landscaping LLC,Ritalynn Branche,PO Box 93,Lunenburg,VT,8024617069,2025,S,No,&nbsp;
2735,"R.J. Piche Excavating, Inc.",Ray Piche,119 Bixby Hill Rd,ESSEX JUNCTION,VT,8023167320,2025,S,No,&nbsp;
2287,Randy Martelle dba Martelle Waste Services,Randy Martelle,447 VT Rte 30,Wells,VT,802-345-1996,2025,S,No,&nbsp;
913,"Ranger, Inc.",Jessica Anger,PO Box 432,Sutton,MA,5088651880,2025,H,No,&nbsp;
413,Ran-Mar Corporation,Greg Rouleau,1083 US Route 2,Berlin,VT,8022239577,2025,S,No,&nbsp;
2593,Rascal&#39;s Rubbish and Redemption LLC,Brandon Fuller,1 River Road,Waterbury,VT,8027982492,2025,S,No,&nbsp;
2343,"Recycling Services, Inc.",Francesco Finocchiaro,166A Merrimack Street,Methuen,MA,6035428755,2025,S,No,&nbsp;
860,"Red Baron Trucking, Inc.",Stephan Zeller,0 Corwin St,Peabody,MA,6175107658,2025,S,No,&nbsp;
918,"RED Technologies, LLC",Katie French,173 Pickering St,Portland,CT,860-342-1022,2025,HS,No,&nbsp;
2339,"REM Transportation, Inc",Alexis Dimmick,595 Neighbor Road,Randolph Center,VT,8023435773,2025,S,No,&nbsp;
2791,Removal Pro LLC,Michael Haikola,PO BOX 880,Raynham Center,MA,7745044288,2025,HS,No,&nbsp;
2749,RENA Enterprises Inc. DBA Bin There Dump That,Ryan McMeniman,294 North Winooski Avenue,Burlington,VT,8028293890,2025,S,No,&nbsp;
772,Renaud Bros Inc,Michael Renaud,283 Fort Bridgman Road,Vernon,VT,8022577383,2025,S,No,&nbsp;
1036,"Republic Environmental System (Transportation Group), LLC",Brittany Winters,7273 State Road 76,Neenah,WI,920-967-7090,2025,HSM,No,&nbsp;
2742,Residuals Test,Me,ghg,kkkkk,VT,9999999999,2025,R,&nbsp;,&nbsp;
688,"Reworld Remediation Services, Inc",Diane Hunt,700 Richmond Street,E. Taunton,MA,508-828-1005,2025,HS,No,&nbsp;
2541,Reynolds Rubbish LLC,"Ralph Reynolds, Jr.",134 Stratton Road,North Clarendon,VT,8024171615,2025,S,No,&nbsp;
2193,RGP Environmental LLC dba 1-800-Got-Junk?,John Wagner,397 Patchen Road #3,South Burlington,VT,8028467714,2025,S,No,&nbsp;
2186,"Rich Earth Institute, Inc.",Arthur Davis,355 Old Ferry Rd.,Brattleboro,VT,8023800775,2025,RS,No,&nbsp;
2140,Richard Benoit DBA Benoit Landscaping,Richard Benoit,PO Box 59,Danville,VT,8022746482,2025,S,No,&nbsp;
977,Richard Rheaume dba R&amp;L Rubbish,Richard Rheaume,215 Munson Road,Middlebury,VT,8023886288,2025,S,No,&nbsp;
2689,Riley&#39;s Services Inc,Riley Bates,90 Stoney Meadow Lane,Mendon,VT,8023455808,2025,S,Yes,&nbsp;
2253,"Robert Bates Inc., dba Bobs Tire Co.",Robert Bates,PO Box 1090,Mattapoisett,MA,5089978545,2025,S,No,&nbsp;
2785,Robert Blanchard dba Robert Blanchard Excavating,Robert Blanchard,P.O. Box 128,Washington,VT,8023718696,2025,S,No,&nbsp;
438,Robert Hooker dba Rons Trucking Partnership,Robert Hooker,1265 Spaulding Rd,St Johnsbury,VT,8027484818,2025,S,No,&nbsp;
2536,"Rocklake, LLC",Mike Pratt,PO Box 345,Montgomery Center,VT,8023263171,2025,S,No,&nbsp;
111,Rodney&#39;s Rubbish LLC,Rodney Companion,3801 Waterbury-Stowe Road,Waterbury Center,VT,8027933640,2025,S,No,&nbsp;
1071,Roger Vesper dba Have Trash Will Travel &amp; Trucking,Billie-Jean Vesper,4973 VT Rte. 14,South Royalton,VT,8023564396,2025,S,No,&nbsp;
2159,Ron Fenoff Excavating LLC,Kimberly McNamara,366 Duck Pond Rd,Waterford,VT,8027487888,2025,S,No,&nbsp;
440,"Ross Transportation Services, Inc.",Dawn Palmer,36790 Giles Road,Grafton,OH,4407485900,2025,H,No,&nbsp;
2430,Rouses Point Sanitation LLC,Andrea Mossey,6 Coton Lane,Champlain,NY,5185690246,2025,S,No,&nbsp;
443,"Rowley Fuels, Inc.",Leslie Rowley,P.O. Box 21,Milton,VT,8028937952,2025,H,No,&nbsp;
2548,Russell &amp; Son LLC,Russell Santamore,PO Box 268,Warren,VT,8024317275,2025,S,No,&nbsp;
446,Rutland County Solid Waste District,Mark Shea,2 Greens Hill Lane,Rutland,VT,8027757209,2025,HS,No,&nbsp;
2543,"RYDER Restoration, Inc. dba SERVPRO of Cheshire County, Windham &amp; Windsor Cos., Barre, Montpelier",Melissa Paul,140 Old Route 12E,Westmoreland,NH,6033527251,2025,SR,No,&nbsp;
1091,S.D. Ireland Brothers Corporation,Byron Furman,PO Box 2286,South Burlington,VT,8023160363,2025,S,No,&nbsp;
2128,S.W.M. Corporation,Guillermo Leon Munoz Castrillion,"1 Dix Street, Apt. 1",Revere,MA,6179593529,2025,SR,No,&nbsp;
452,"Safety-Kleen Systems, Inc.",Colleen Costello,42 Longwater Drive,Norwell,MA,781-792-5787,2025,HRSM,No,&nbsp;
1038,Sam Carter dba Cloud&#39;s Path Farm,Eliza Perreault,491 Hod Brooks Road,Sheffield,VT,8022747177,2025,s,Yes,&nbsp;
2427,"Sam Duffy dba Take it Away, Sam!",Sam Duffy,73 Little Pond Rd,Londonderry,VT,8023809760,2025,S,No,&nbsp;
2388,Sam Longmoore dba North Country Clean Out,Sam Longmoore,2362 Leighton Hill Rd,Wells River,VT,8025350489,2025,S,No,&nbsp;
2524,Samm Consulting LLC,Ron Stark,2 Old Country Road,Winhall,VT,8028399302,2025,S,No,&nbsp;
2438,"Sam&#39;s Service Center &amp; U-Save Fuels, Inc.",Amy Proctor,352 VT Rte 4A E,Fair Haven,VT,8022653608,2025,S,No,&nbsp;
971,Sandberg Enterprises LLC dba Cookeville Compost,Robert Sandberg,PO Box 466,Corinth,VT,8024395563,2025,S,No,&nbsp;
336,Sandra Marsh dba Floyd&#39;s Rubbish Removal,Sandra Marsh,9 Quinttown Road,Orford,NH,6033539327,2025,S,No,&nbsp;
2685,SBC Property Maintenance LLC,Samuel B Clement Jr,524 Stebbins Road,Vernon,VT,8023801317,2025,S,No,&nbsp;
460,"Schofields Septic Tank Service, Inc.",Kevin C. Schofield,1121 Route 302,Lisbon,NH,6038386028,2025,R,No,&nbsp;
1096,"SCOTT SMITH TRUCKING, INC.",LAURALEE SMITH,PO BOX 616,WILLIAMSTOWN,MA,4135537162,2025,S,No,&nbsp;
2112,SDJ Services of Pelham LLC,Gerald J. Dallaire,PO Box 304,Sandown,NH,9788157859,2025,SR,No,&nbsp;
2219,"Second Act Transition Services, L3C",Donald Rathgeb Jr.,16 Sunset Drive,Burlington,VT,8025787485,2025,S,No,&nbsp;
925,Septic Pro LLC,Stephen Pro,PO Box 364,Keene,NH,8022545400,2025,R,No,&nbsp;
466,"Sheldon Oil Services, Inc.",Guy Sheldon,P.O. Box 839,Nassau,NY,5187662864,2025,H,No,&nbsp;
697,Shred This Inc.,Stephen Millette,PO BOX 2123,So. Burlington,VT,8028633003,2025,S,No,&nbsp;
990,Shred-Ex LLC,Todd Klimoski,529 Jasper Mine Road,Colchester,VT,8028630404,2025,S,No,&nbsp;
449,SJ TRANSPORTATION CO. INC,MARY ANN LEE,"PO Box 169, 1176 US Route 40",Woodstown,NJ,8568075234,2025,HRSM,No,&nbsp;
2359,"Sleep Well Recycling, LLC.",Joshua Costa,525 Riverside Ave,Burlington,VT,6033212335,2025,S,No,&nbsp;
2761,Southern Vermont Waste Removal LLC,Keegan Babson,PO Box 1003,Bennington,VT,8024422245,2025,S,No,&nbsp;
2734,"Southworth-Milton, Inc. dba Milton-CAT",Ward Butler,150 CAT Lane,Richmond,VT,8024347805,2025,HS,No,&nbsp;
2757,SPC Enterprise LLC,Shawn Connors,286 Black Hill Road,Plainfield,CT,4016481517,2025,S,No,&nbsp;
2459,Sprockets Limited Liability Company,Steve Connolly,42 Union Street,Windsor,VT,8022911063,2025,S,No,&nbsp;
1010,SRS National LLC,Tamara L. Plourd or James Beaudoin,199 Lazy Lane,Southington,CT,8606289993,2025,S,No,&nbsp;
932,"St. Onge Transport, Inc.",Daniel St. Onge,PO BOX 1472,Derby,VT,8023343044,2025,S,No,&nbsp;
644,"Stearns Septic Service, LLC",Brian / Tina Stearns,PO Box 1167,Grantham,NH,6034429500,2025,R,No,&nbsp;
476,Stericycle Inc.,Marvin Bowers,7273 State Road 76,Neenah,WI,9209677156,2025,SM,No,&nbsp;
498,Steve Loud dba Timberwolf Rubbish Removal,Steve Loud,10 Holly Street,Woodsville,NH,6039918182,2025,S,Yes,&nbsp;
479,"Steve&#39;s Septic Service, LLC",Steven P. King,481 Stebbins Road,Vernon,VT,8022571619,2025,R,No,&nbsp;
846,"Stone Industries, LLC",Stephanie Schroder-Loveland,4305 Route 50,Saratoga Springs,NY,5185841048,2025,R,No,&nbsp;
2597,Stones&#39; Septic LLC,Brian Stone,39 Goodell Ave,Swanzey,NH,6033135002,2025,SR,No,&nbsp;
2504,Straight Flush LLC,Derek Flint,790 Winchester Hill Road,Williamstown,VT,8023690051,2025,R,No,&nbsp;
1073,"Strategic Environmental Services, Inc.",Laura Gaspa,362 Putnam Hill Road,Sutton,MA,5087577782,2025,HS,No,&nbsp;
2605,Sun Environmental Corp.,Sun Environmental Corp.,4655 Crossroads Park Drive,Liverpool,NY,3156797731,2025,HSR,No,&nbsp;
2748,Sunrise Property Maintenance LLC.,Justin French,51 North Road,Milton,VT,8023737761,2025,S,No,&nbsp;
2285,SVCS Inc.,Ryan Walton,28 South Main Street,Rutland,VT,8025859783,2025,S,No,&nbsp;
1072,Sylvester&#39;s Trucking LLC,Benjamin W. Sylvester,482 Jay Road,Richford,VT,8028483413,2025,SR,No,&nbsp;
